Rhys, the Evermore	1	Effect:remove	Flash / When Rhys enters, another target creature you control gains persist until end of turn. (When it dies, if it had no -1/-1 counters on it, return it to the battlefield under its owner's control with a -1/-1 counter on it.) / {W}, {T}: Remove any number of counters from target creature you control. Activate only as a sorcery.
Fear of Immobility	1	Swallow:Condition_If	When this creature enters, tap up to one target creature. If an opponent controls that creature, put a stun counter on it. (If a permanent with a stun counter would become untapped, remove one from it instead.)
Alania, Divergent Storm	1	Effect:the	Whenever you cast a spell, if it's the first instant spell, the first sorcery spell, or the first Otter spell other than Alania you've cast this turn, you may have target opponent draw a card. If you do, copy that spell. You may choose new targets for the copy.
Luxurious Locomotive	1	Swallow:DynamicQty	Whenever this Vehicle attacks, create a Treasure token for each creature that crewed it this turn. (They're artifacts with "{T}, Sacrifice this token: Add one mana of any color.") / Crew 1. Activate only once each turn. (Tap any number of creatures you control with total power 1 or more: This Vehicle becomes an artifact creature until end of turn.)
Sharae of Numbing Depths	1	Trigger:Whenever you tap one or more untapped creatures your opponents control	When Sharae enters, tap target creature an opponent controls and put a stun counter on it. (If a permanent with a stun counter would become untapped, remove one from it instead.) / Whenever you tap one or more untapped creatures your opponents control, draw a card. This ability triggers only once each turn.
Unstable Glyphbridge	1	Effect:for	When this artifact enters, if you cast it, for each player, choose a creature with power 2 or less that player controls. Then destroy all creatures except creatures chosen this way. / Craft with artifact {3}{W}{W} ({3}{W}{W}, Exile this artifact, Exile another artifact you control or an artifact card from your graveyard: Return this card transformed under its owner's control. Craft only as a sorcery.)
Fearless Swashbuckler	1	Swallow:Condition_If	Haste / Vehicles you control have haste. / Whenever you attack, if a Pirate and a Vehicle attacked this combat, draw three cards, then discard two cards.
Rubblebelt Braggart	1	Swallow:Condition_If	Whenever this creature attacks, if it's not suspected, you may suspect it. (A suspected creature has menace and can't block.)
Throw from the Saddle	2	Swallow:Condition_If;Swallow:DynamicQty	Target creature you control gets +1/+1 until end of turn. Put a +1/+1 counter on it instead if it's a Mount. Then it deals damage equal to its power to target creature you don't control.
Locus of Enlightenment	1	Effect:static_structure	Locus of Enlightenment has each activated ability of the exiled cards used to craft it. You may activate each of those abilities only once each turn. / Whenever you activate an ability that isn't a mana ability, copy it. You may choose new targets for the copy.
Wojek Investigator	1	Swallow:DynamicQty	Flying, vigilance / At the beginning of your upkeep, investigate once for each opponent who has more cards in hand than you. (To investigate, create a Clue token. It's an artifact with "{2}, Sacrifice this token: Draw a card.")
Cinder Strike	1	Swallow:Condition_If	As an additional cost to cast this spell, you may blight 1. (You may put a -1/-1 counter on a creature you control.) / Cinder Strike deals 2 damage to target creature. It deals 4 damage to that creature instead if this spell's additional cost was paid.
Pyromancer's Goggles	2	Effect:orphaned_copy_retarget;Effect:when	{T}: Add {R}. When that mana is spent to cast a red instant or sorcery spell, copy that spell and you may choose new targets for the copy.
Omniscience	1	Swallow:Optional_YouMay	You may cast spells from your hand without paying their mana costs.
Puca's Eye	1	Swallow:Condition_If	When this artifact enters, draw a card, then choose a color. This artifact becomes the chosen color. / {3}, {T}: Draw a card. Activate only if there are five colors among permanents you control.
Nesting Bot	0		Start your engines! (If you have no speed, it starts at 1. It increases once on each of your turns when an opponent loses life. Max speed is 4.) / When this creature dies, create a 1/1 colorless Servo artifact creature token. / Max speed — This creature gets +1/+0.
Eriette, the Beguiler	1	Trigger:Whenever an Aura you control becomes attached to a nonland permanent an opponent controls with mana value less than or equal to that Aura's mana value	Lifelink / Whenever an Aura you control becomes attached to a nonland permanent an opponent controls with mana value less than or equal to that Aura's mana value, gain control of that permanent for as long as that Aura is attached to it.
Torch the Tower	1	Swallow:Duration_ThisTurn	Bargain (You may sacrifice an artifact, enchantment, or token as you cast this spell.) / Torch the Tower deals 2 damage to target creature or planeswalker. If this spell was bargained, instead it deals 3 damage to that permanent and you scry 1. / If a permanent dealt damage by Torch the Tower would die this turn, exile it instead.
Molten Exhale	1	Swallow:Condition_If	You may cast this spell as though it had flash if you behold a Dragon as an additional cost to cast it. (To behold a Dragon, choose a Dragon you control or reveal a Dragon card from your hand.) / Molten Exhale deals 4 damage to target creature or planeswalker.
Ultimate Spider-Man	1	Swallow:DynamicQty	First strike, haste / Camouflage — {2}: Put a +1/+1 counter on Ultimate Spider-Man. He gains hexproof and becomes colorless until end of turn. / Whenever you attack, double the number of each kind of counter on each Spider and legendary creature you control.
Outrageous Robbery	1	Effect:spend	Target opponent exiles the top X cards of their library face down. You may look at and play those cards for as long as they remain exiled. If you cast a spell this way, you may spend mana as though it were mana of any type to cast it.
The Legend of Yangchen	1	Effect:choose	(As this Saga enters and after your draw step, add a lore counter.) / I — Starting with you, each player chooses up to one permanent with mana value 3 or greater from among permanents your opponents control. Exile those permanents. / II — You may have target opponent draw three cards. If you do, draw three cards. / III — Exile this Saga, then return it to the battlefield transformed under your control.
The Millennium Calendar	2	Trigger:When there are 1,000 or more time counters on ~;Trigger:Whenever you untap one or more permanents during your untap step	Whenever you untap one or more permanents during your untap step, put that many time counters on The Millennium Calendar. / {2}, {T}: Double the number of time counters on The Millennium Calendar. / When there are 1,000 or more time counters on The Millennium Calendar, sacrifice it and each opponent loses 1,000 life.
Esper Terra	2	Effect:add;Effect:put	(As this Saga enters and after your draw step, add a lore counter.) / I, II, III — Create a token that's a copy of target nonlegendary enchantment you control. It gains haste. If it's a Saga, put up to three lore counters on it. Sacrifice it at the beginning of your next end step. / IV — Add {W}{W}, {U}{U}, {B}{B}, {R}{R}, and {G}{G}. Exile Esper Terra, then return it to the battlefield (front face up). / Flying
Diligent Zookeeper	1	Swallow:DynamicQty	Each non-Human creature you control gets +1/+1 for each of its creature types, to a maximum of 10.
A Killer Among Us	1	Swallow:Condition_If	When this enchantment enters, create a 1/1 white Human creature token, a 1/1 blue Merfolk creature token, and a 1/1 red Goblin creature token. Then secretly choose Human, Merfolk, or Goblin. / Sacrifice this enchantment, Reveal the creature type you chose: If target attacking creature token is the chosen type, put three +1/+1 counters on it and it gains deathtouch until end of turn.
Thousand-Year Storm	1	Swallow:DynamicQty	Whenever you cast an instant or sorcery spell, copy it for each other instant and sorcery spell you've cast before it this turn. You may choose new targets for the copies.
The Dominion Bracelet	1	Effect:this	Equipped creature gets +1/+1 and has "{15}, Exile The Dominion Bracelet: You control target opponent during their next turn. This ability costs {X} less to activate, where X is this creature's power. Activate only as a sorcery." (You see all cards that player could see and make all decisions for them.) / Equip {1}
Oviya, Automech Artisan	1	Swallow:Condition_If	Each creature that's attacking one of your opponents has trample. / {G}, {T}: You may put a creature or Vehicle card from your hand onto the battlefield. If you put an artifact onto the battlefield this way, put two +1/+1 counters on it.
Cecil, Dark Knight	0		Deathtouch / Darkness — Whenever Cecil deals damage, you lose that much life. Then if your life total is less than or equal to half your starting life total, untap Cecil and transform it.
Grab the Prize	1	Swallow:Condition_If	As an additional cost to cast this spell, discard a card. / Draw two cards. If the discarded card wasn't a land card, Grab the Prize deals 2 damage to each opponent.
Katara, Water Tribe's Hope	1	Swallow:ActivateOnlyDuring	Vigilance / When Katara enters, create a 1/1 white Ally creature token. / Waterbend {X}: Creatures you control have base power and toughness X/X until end of turn. X can't be 0. Activate only during your turn. (While paying a waterbend cost, you can tap your artifacts and creatures to help. Each one pays for {1}.)
Stargaze	1	Effect:look	Look at twice X cards from the top of your library. Put X cards from among them into your hand and the rest into your graveyard. You lose X life.
Ojer Axonil, Deepest Might	1	Swallow:DynamicQty	Trample / If a red source you control would deal an amount of noncombat damage less than Ojer Axonil's power to an opponent, that source deals damage equal to Ojer Axonil's power instead. / When Ojer Axonil dies, return it to the battlefield tapped and transformed under its owner's control.
Spider-Verse	1	Effect:orphaned_copy_retarget	The "legend rule" doesn't apply to Spiders you control. / Whenever you cast a spell from anywhere other than your hand, you may copy it. If you do, you may choose new targets for the copy. If the copy is a permanent spell, it gains haste. Do this only once each turn.
Dracogenesis	1	Swallow:Optional_YouMay	You may cast Dragon spells without paying their mana costs.
Portent of Calamity	1	Swallow:Condition_If	Reveal the top X cards of your library. For each card type, you may exile a card of that type from among them. Put the rest into your graveyard. You may cast a spell from among the exiled cards without paying its mana cost if you exiled four or more cards this way. Then put the rest of the exiled cards into your hand.
Knight of Malice	0		First strike (This creature deals combat damage before creatures without first strike.) / Hexproof from white (This creature can't be the target of white spells or abilities your opponents control.) / This creature gets +1/+0 as long as any player controls a white permanent.
Driftgloom Coyote	1	Swallow:Condition_If	When this creature enters, exile target creature an opponent controls until this creature leaves the battlefield. If that creature had power 2 or less, put a +1/+1 counter on this creature.
Combustion Man	1	Effect:Unsupported unless clause	Whenever Combustion Man attacks, destroy target permanent unless its controller has Combustion Man deal damage to them equal to his power.
Rakdos, the Muscle	1	Swallow:DynamicQty	Flying, trample / Whenever you sacrifice another creature, exile cards equal to its mana value from the top of target player's library. Until your next end step, you may play those cards, and mana of any type can be spent to cast those spells. / Sacrifice another creature: Rakdos gains indestructible until end of turn. Tap it. Activate only once each turn.
Walking Sarcophagus	0		Start your engines! (If you have no speed, it starts at 1. It increases once on each of your turns when an opponent loses life. Max speed is 4.) / Max speed — This creature gets +1/+2.
Coiling Rebirth	1	Swallow:Condition_If	Gift a card (You may promise an opponent a gift as you cast this spell. If you do, they draw a card before its other effects.) / Return target creature card from your graveyard to the battlefield. Then if the gift was promised and that creature isn't legendary, create a token that's a copy of that creature, except it's 1/1.
Master's Manufactory	1	Swallow:Condition_If	{T}: Create a 4/4 white and blue Golem artifact creature token. Activate only if this artifact or another artifact entered the battlefield under your control this turn.
Curator of Sun's Creation	2	Effect:discover;Trigger:Whenever you discover	Whenever you discover, discover again for the same value. This ability triggers only once each turn.
Cache Grab	1	Swallow:Condition_If	Mill four cards. You may put a permanent card from among the cards milled this way into your hand. If you control a Squirrel or returned a Squirrel card to your hand this way, create a Food token. (To mill four cards, put the top four cards of your library into your graveyard. A Food token is an artifact with "{2}, {T}, Sacrifice this token: You gain 3 life.")
Sarkhan, Dragon Ascendant	1	Effect:behold	When Sarkhan enters, you may behold a Dragon. If you do, create a Treasure token. (To behold a Dragon, choose a Dragon you control or reveal a Dragon card from your hand.) / Whenever a Dragon you control enters, put a +1/+1 counter on Sarkhan. Until end of turn, Sarkhan becomes a Dragon in addition to its other types and gains flying.
Gastal Raider	0		Start your engines! / When this creature enters, target opponent reveals their hand. You choose an instant or sorcery card from it. That player discards that card. / Max speed — This creature gets +1/+1 and has menace.
Hundred-Battle Veteran	0		As long as there are three or more different kinds of counters among creatures you control, this creature gets +2/+4. / You may cast this card from your graveyard. If you do, it enters with a finality counter on it. (If a creature with a finality counter on it would die, exile it instead.)
Yenna, Redtooth Regent	1	Swallow:Condition_If	{2}, {T}: Choose target enchantment you control that doesn't have the same name as another permanent you control. Create a token that's a copy of it, except it isn't legendary. If the token is an Aura, untap Yenna, then scry 2. Activate only as a sorcery.
Innocent Bystander	1	Trigger:Whenever ~ is dealt 3 or more damage	Whenever this creature is dealt 3 or more damage, investigate. (Create a Clue token. It's an artifact with "{2}, Sacrifice this token: Draw a card.")
Lady Octopus, Inspired Inventor	1	Trigger:Whenever you draw your first or second card each turn	Whenever you draw your first or second card each turn, put an ingenuity counter on Lady Octopus. / {T}: You may cast an artifact spell from your hand with mana value less than or equal to the number of ingenuity counters on Lady Octopus without paying its mana cost.
Neriv, Heart of the Storm	1	Swallow:DynamicQty	Flying / If a creature you control that entered this turn would deal damage, it deals twice that much damage instead.
Trance Kuja, Fate Defied	1	Swallow:Condition_If	Flare Star — If a Wizard you control would deal damage to a permanent or player, it deals double that damage instead.
Vanille, Cheerful l'Cie	1	Effect:fearless	When Vanille enters, mill two cards, then return a permanent card from your graveyard to your hand. / At the beginning of your first main phase, if you both own and control Vanille and a creature named Fang, Fearless l'Cie, you may pay {3}{B}{G}. If you do, exile them, then meld them into Ragnarok, Divine Deliverance.
Riku of Many Paths	1	Swallow:DynamicQty	Whenever you cast a modal spell, choose up to X, where X is the number of times you chose a mode for that spell — / • Exile the top card of your library. Until the end of your next turn, you may play it. / • Put a +1/+1 counter on Riku. It gains trample until end of turn. / • Create a 1/1 blue Bird creature token with flying.
Zimone, All-Questioning	1	Swallow:Duration_ThisTurn	At the beginning of your end step, if a land entered the battlefield under your control this turn and you control a prime number of lands, create Primo, the Indivisible, a legendary 0/0 green and blue Fractal creature token, then put that many +1/+1 counters on it. (2, 3, 5, 7, 11, 13, 17, 19, 23, 29, and 31 are prime numbers.)
The Tomb of Aclazotz	1	Effect:it	(Transforms from Tarrian's Journal.) / {T}: Add {B}. / {T}: You may cast a creature spell from your graveyard this turn. If you do, it enters with a finality counter on it and is a Vampire in addition to its other types. (If a creature with a finality counter on it would die, exile it instead.)
Blasphemous Edict	1	Swallow:Condition_If	You may pay {B} rather than pay this spell's mana cost if there are thirteen or more creatures on the battlefield. / Each player sacrifices thirteen creatures of their choice.
Bumi, King of Three Trials	1	Swallow:DynamicQty	When Bumi enters, choose up to X, where X is the number of Lesson cards in your graveyard — / • Put three +1/+1 counters on Bumi. / • Target player scries 3. / • Earthbend 3. (Target land you control becomes a 0/0 creature with haste that's still a land. Put three +1/+1 counters on it. When it dies or is exiled, return it to the battlefield tapped.)
Slumbering Trudge	1	Swallow:Condition_If	This creature enters with a number of stun counters on it equal to three minus X. If X is 2 or less, it enters tapped. (If a permanent with a stun counter would become untapped, remove one from it instead.)
Braided Net	1	Swallow:Condition_AsLongAs	This artifact enters with three net counters on it. / {T}, Remove a net counter from this artifact: Tap another target nonland permanent. Its activated abilities can't be activated for as long as it remains tapped. / Craft with artifact {1}{U}
Party Dude	1	Trigger:Whenever one or more of your opponents are attacked	(Gain the next level as a sorcery to add its ability.) / When this Class enters, each player creates a Food token. / {1}{G}: Level 2 / Whenever an artifact an opponent controls is put into a graveyard from the battlefield, draw a card. / {4}{G}: Level 3 / Whenever one or more of your opponents are attacked, up to one target attacking creature gets +X/+X until end of turn, where X is the number of cards in your hand.
Burnout Bashtronaut	0		Menace / Start your engines! (If you have no speed, it starts at 1. It increases once on each of your turns when an opponent loses life. Max speed is 4.) / {2}: This creature gets +1/+0 until end of turn. / Max speed — This creature has double strike.
No Witnesses	1	Effect:the	Each player who controls the most creatures investigates. Then destroy all creatures. (To investigate, create a Clue token. It's an artifact with "{2}, Sacrifice this token: Draw a card.")
Charging Hooligan	1	Swallow:Condition_If	Whenever this creature attacks, it gets +1/+0 until end of turn for each attacking creature. If a Rat is attacking, this creature gains trample until end of turn.
Outlaw Stitcher	1	Swallow:DynamicQty	When this creature enters, create a 2/2 blue and black Zombie Rogue creature token, then put two +1/+1 counters on that token for each spell you've cast this turn other than the first. / Plot {4}{U} (You may pay {4}{U} and exile this card from your hand. Cast it as a sorcery on a later turn without paying its mana cost. Plot only as a sorcery.)
Brackish Blunder	1	Swallow:Condition_If	Return target creature to its owner's hand. If it was tapped, create a Map token. (It's an artifact with "{1}, {T}, Sacrifice this token: Target creature you control explores. Activate only as a sorcery.")
Nashi, Searcher in the Dark	1	Swallow:Condition_If	Menace / Whenever Nashi deals combat damage to a player, you mill that many cards. You may put any number of legendary and/or enchantment cards from among them into your hand. If you put no cards into your hand this way, put a +1/+1 counter on Nashi.
Sokka's Haiku	0		Counter target spell. / Draw a card, then mill three cards. / Untap target land.
Case of the Uneaten Feast	1	Swallow:Optional_YouMay	Whenever a creature you control enters, you gain 1 life. / To solve — You've gained 5 or more life this turn. (If unsolved, solve at the beginning of your end step.) / Solved — Sacrifice this Case: Creature cards in your graveyard gain "You may cast this card from your graveyard" until end of turn.
Discerning Financier	1	Effect:choose	At the beginning of your upkeep, if an opponent controls more lands than you, create a Treasure token. (It's an artifact with "{T}, Sacrifice this token: Add one mana of any color.") / {2}{W}: Choose another player. That player gains control of target Treasure you control. You draw a card.
Inquisitive Glimmer	1	Effect:static_structure	Enchantment spells you cast cost {1} less to cast. / Unlock costs you pay cost {1} less.
Machinist's Arsenal	1	Swallow:DynamicQty	Job select (When this Equipment enters, create a 1/1 colorless Hero creature token, then attach this to it.) / Equipped creature gets +2/+2 for each artifact you control and is an Artificer in addition to its other types. / Machina — Equip {4} ({4}: Attach to target creature you control. Equip only as a sorcery.)
Amalia Benavides Aguirre	1	Swallow:Condition_If	Ward—Pay 3 life. / Whenever you gain life, Amalia Benavides Aguirre explores. Then destroy all other creatures if its power is exactly 20. (To have this creature explore, reveal the top card of your library. Put that card into your hand if it's a land. Otherwise, put a +1/+1 counter on this creature, then put the card back or put it into your graveyard.)
Knight of Grace	0		First strike (This creature deals combat damage before creatures without first strike.) / Hexproof from black (This creature can't be the target of black spells or abilities your opponents control.) / This creature gets +1/+0 as long as any player controls a black permanent.
Vincent's Limit Break	3	Effect:{0};Effect:{1};Effect:{3}	Tiered (Choose one additional cost.) / Until end of turn, target creature you control gains "When this creature dies, return it to the battlefield tapped under its owner's control" and has the chosen base power and toughness. / • Galian Beast — {0} — 3/2. / • Death Gigas — {1} — 5/2. / • Hellmasker — {3} — 7/2.
Jolly Gerbils	1	Trigger:Whenever you give a gift	Whenever you give a gift, draw a card.
Overgrown Zealot	1	Effect:spend	{T}: Add one mana of any color. / {T}: Add two mana of any one color. Spend this mana only to turn permanents face up.
Gastal Thrillseeker	0		Start your engines! (If you have no speed, it starts at 1. It increases once on each of your turns when an opponent loses life. Max speed is 4.) / When this creature enters, it deals 1 damage to target opponent and you gain 1 life. / Max speed — This creature has deathtouch and haste.
Ultimecia, Time Sorceress	1	ParseWarning:target-fallback	Whenever Ultimecia enters or attacks, surveil 2. (Look at the top two cards of your library, then put any number of them into your graveyard and the rest on top of your library in any order.) / At the beginning of your end step, you may pay {4}{U}{U}{B}{B} and exile eight cards from your graveyard. If you do, transform Ultimecia.
Mirrormind Crown	1	Swallow:Optional_YouMay	As long as this Equipment is attached to a creature, the first time you would create one or more tokens each turn, you may instead create that many tokens that are copies of equipped creature. / Equip {2}
Ran and Shaw	1	Swallow:Condition_If	Flying, firebending 2 / When Ran and Shaw enter, if you cast them and there are three or more Dragon and/or Lesson cards in your graveyard, create a token that's a copy of Ran and Shaw, except it's not legendary. / {3}{R}: Dragons you control get +2/+0 until end of turn.
Sandman's Quicksand	1	Swallow:Condition_If	Mayhem {3}{B} (You may cast this card from your graveyard for {3}{B} if you discarded it this turn. Timing rules still apply.) / All creatures get -2/-2 until end of turn. If this spell's mayhem cost was paid, creatures your opponents control get -2/-2 until end of turn instead.
Yarus, Roar of the Old Gods	1	Swallow:Condition_If	Other creatures you control have haste. / Whenever one or more face-down creatures you control deal combat damage to a player, draw a card. / Whenever a face-down creature you control dies, return it to the battlefield face down under its owner's control if it's a permanent card, then turn it face up.
Mazemind Tome	1	Trigger:When there are four or more page counters on ~	{T}, Put a page counter on this artifact: Scry 1. (Look at the top card of your library. You may put that card on the bottom.) / {2}, {T}, Put a page counter on this artifact: Draw a card. / When there are four or more page counters on this artifact, exile it. If you do, you gain 4 life.
Rampaging Soulrager	0		This creature gets +3/+0 as long as there are two or more unlocked doors among Rooms you control.
